Q2_1,Q2_2,Q2_3,Q2_4,Q2_5,Q2_6,Q2_7,Q2_8,Q3,Q4,Q5_1,Q5_2,Q5_3,Q5_4,Q5_5,Q5_6,Q5_7,Q5_8,Q5_9,Q5_10,Q5_11,Q5_12,Q5_13,Q5_14,Q5_15,Q5_16,Q5_17,Q5_18,Q6,Q5_19,Q5_20,Q5_21,Q5_22,Q5_23,Q5_24,Q5_25,Q5_26,Q5_27,Q5_28,Q5_29,Q5_30,Q5_31,Q5_32,Q5_33,Q5_34,Q5_35,Q5_36,Q8,Q9_1,Q9_2,Q9_3,Q9_4,Q9_5,Q9_6,Q9_7,Q9_8,Q9_9,Q9_10,Q9_11,Q9_12,Q9_13,Q9_14,Q9_15,Q9_16,Q9_17,Q9_18,Q9_19,Q9_20,Q10,Q11_1,Q11_2,Q11_3,Q11_4,Q11_5,Q11_6,Q11_7,Q11_8,Q11_9,Q11_10,Q11_11,Q11_12,Q11_13,Q11_14,Q11_15,Q11_16,Q11_17,Q11_18,Q11_19,Q11_20,Q12,Q11_21,Q11_22,Q11_23,Q11_24,Q11_25,Q11_26,Q11_27,Q11_28,Q11_29,Q11_30,Q11_31,Q11_32,Q11_33,Q11_34,Q11_35,Q11_36,Q11_37,Q11_38,Q11_39,Q11_40,Q14,Q11_41,Q11_42,Q11_43,Q11_44,Q11_45,Q11_46,Q11_47,Q11_48,Q11_49,Q11_50,Q11_51,Q11_52,Q11_53,Q11_54,Q11_55,Q11_56,Q11_57,Q11_58,Q11_59,Q11_60,Q16,Q17_1,Q17_2,Q17_3,Q17_4,Q17_5,Q17_6,Q17_7,Q17_8,Q17_9,Q17_10,Q17_11,Q17_12,Q17_13,Q17_14,Q17_15,Q17_16,Q17_17,Q17_18,Q18,Q19,Q22
"Please indicate below if you consent to take part in the study - I am over 18 years of age and I voluntarily agree to participate in a research project conducted by Catherine Sheen, a 3rd year Psychology student at Staffordshire University.",Please indicate below if you consent to take part in the study - I have read the information sheet and understand that this research is being conducted as part of a psychology undergraduate's third year project,Please indicate below if you consent to take part in the study - I understand that I am being asked to participate in a study lasting approx. 45 minutes and I will be asked to fill in 4 separate questionnaires.,Please indicate below if you consent to take part in the study - I understand that I may withdraw from participating without penalty if I so wish and my data will be destroyed. I have been informed that withdrawal after completing the study will not be possible,"Please indicate below if you consent to take part in the study - I understand I will be fully protected in accordance with the Data Protection Act of 2018, and in compliance with the British Psychological Society ethical guidelines, and that my data will be kept confidential and anonymous until they are securely destroyed.",Please indicate below if you consent to take part in the study - I understand that any personal details will be anonymised in any report based on this study. I agree that any of the data I provide may be used in the researcher’s report and possibly used for publication in academic journals.,"Please indicate below if you consent to take part in the study - I understand that in the case that the data are used for publication, they will be kept until ten years after the article has been published, and then destroyed.",Please indicate below if you consent to take part in the study - I understand that this questionnaire cannot be used for diagnostic purposes and therefore individual scores on any of the provided scales will not be provided or expanded on.,Please enter your sex at birth,Please enter your age in numbers,Questionnaire One - I am clear about my feelings,Questionnaire One - I pay attention to how I feel,Questionnaire One - I experience my emotions as overwhelming and out of control,Questionnaire One - I have no idea how I am feeling,Questionnaire One - I have difficulty making sense out of my feelings,Questionnaire One - I am attentive to my feelings,Questionnaire One - I know exactly how I am feeling,Questionnaire One - I care about what I am feeling,Questionnaire One - I am confused about how I feel,"Questionnaire One - When I'm upset, I acknowledge my emotions","Questionnaire One - When I'm upset, I become angry with myself for feeling that way","Questionnaire One - When I'm upset, I become embarrassed for feeling that way","Questionnaire One - When I'm upset, I have difficulty getting work done","Questionnaire One - When I'm upset, I become out of control","Questionnaire One - When I'm upset, I believe that I will remain that way for a long time","Questionnaire One - When I'm upset, I believe that I will end up feeling very depressed","Questionnaire One - When I'm upset, I believe that my feelings are valid and important","Questionnaire One - When I'm upset, I have difficulty focusing on other things",Would you like to exit the study and go to the debrief?,"Questionnaire One - When I'm upset, I feel out of control","Questionnaire One - When I'm upset, I can still get things done","Questionnaire One - When I'm upset, I feel ashamed at myself for feeling that way","Questionnaire One - When I'm upset, I know that I can find a way to eventually feel better","Questionnaire One - When I'm upset, I feel weak","Questionnaire One - When I'm upset, I feel like I can remain in control of my behaviours","Questionnaire One - When I'm upset, I feel guilty for feeling that way","Questionnaire One - When I'm upset, I have difficulty concentrating","Questionnaire One - When I'm upset, I have difficulty controlling my behaviours","Questionnaire One - When I'm upset, I believe there is nothing I can do to make myself feel better","Questionnaire One - When I'm upset, I become irritated at myself for feeling that way","Questionnaire One - When I'm upset, I start to feel very bad about myself","Questionnaire One - When I'm upset, I believe that wallowing in it is all I can do","Questionnaire One - When I'm upset, I lose control of my behaviour","Questionnaire One - When I'm upset, I have difficulty thinking about anything else",Questionnaire One - When I'm upset I take time to figure out what I'm really feeling,"Questionnaire One - When I'm upset, it takes me a long time to feel better","Questionnaire One - When I'm upset, my emotions feel overwhelming",Would you like to exit the study and go to the debrief?,Questionnaire Two - I was bothered by things that don't usually bother me,Questionnaire Two - I did not feel like eating; my appetite was poor,Questionnaire Two - I felt that I could not shake of the blues even with help from my family or friends,Questionnaire Two - I felt that I was just as good as other people,Questionnaire Two - I had trouble keeping my mind on what I was doing,Questionnaire Two - I felt depressed,Questionnaire Two - I felt that everything I did was an effort,Questionnaire Two - I felt hopeful about the future,Questionnaire Two - I thought my life had been a failure,Questionnaire Two - I felt fearful,Questionnaire Two - My sleep was restless,Questionnaire Two - I was happy,Questionnaire Two - I talked less then usual,Questionnaire Two - I felt lonely,Questionnaire Two - People were unfriendly,Questionnaire Two - I enjoyed life,Questionnaire Two - I had crying spells,Questionnaire Two - I felt sad,Questionnaire Two - I felt that people dislike me,Questionnaire Two - I could not get going,Would you like to exit the study and go to the debrief?,Questionnaire Three - I can easily tell if someone else wants to enter a conversation,Questionnaire Three - I prefer animals to humans,Questionnaire Three - I try to keep up with the current trends and fashions,"Questionnaire Three - I find it difficult to explain to others things that I understand easily, when they don't understand it the first time",Questionnaire Three - I dream most nights,Questionnaire Three - I really enjoy caring for other people,Questionnaire Three - I try to solve my own problems rather than discussing them with others,Questionnaire Three - I find it hard to know what to do in a social situation,Questionnaire Three - I am at my best first thing in the morning,Questionnaire Three - People often tell me that I went too far in driving my point home in a discussion,Questionnaire Three - It doesn't bother me too much if I am late meeting a friend,"Questionnaire Three - Friendships and relationships are just too difficult, so I tend not to bother with them","Questionnaire Three - I would never break the law, no matter how minor",Questionnaire Three - I often find it difficult to judge if something is rude or polite,"Questionnaire Three - In a conversation, I tend to focus on my own thoughts rather than on what my listener might be thinking",Questionnaire Three - I prefer practical jokes to verbal humour,Questionnaire Three - I live life for today rather than the future,"Questionnaire Three - When I was a child, I enjoyed cutting up worms to see what would happen",Questionnaire Three - I can pick up quickly if someone says one thing but means another,Questionnaire Three - I tend to have very strong opinions about morality,Would you like to exit the study and go to the debrief?,Questionnaire Three - It is hard for me to see why some things upset people so much,Questionnaire Three - I find it easy to put myself in somebody else's shoes,Questionnaire Three - I think that good manners are the most important thing a parent can teach their child,Questionnaire Three - I like to do things on the spur of the moment,Questionnaire Three - I am good at predicting how someone will feel,Questionnaire Three - I am quick to spot when someone in a group is feeling awkward or uncomfortable,"Questionnaire Three - If I say something that someone else is offended by, I think that's their problem, not mine","Questionnaire Three - If anyone asked me if I like their haircut, I would reply truthfully, even if I didn't like it",Questionnaire Three - I can't always see why someone should have felt offended by a remark,Questionnaire Three - People often tell me that I am very unpredictable,Questionnaire Three - I enjoy being the centre of attention at any social gathering,Questionnaire Three - Seeing people cry doesn't really upset me,Questionnaire Three - I enjoy having discussions about politics,"Questionnaire Three - I am very blunt, which some people take to be rudeness, even though this is unintentional",Questionnaire Three - I don't tend to find social situations confusing,Questionnaire Three - Other people tell me I am good at understanding how they are feeling and what they are thinking,"Questionnaire Three - When i talk to people, I tend to talk about their experiences rather thean my own",Questionnaire Three - It upsets me to see animals in pain,Questionnaire Three - I am able to make decisions without being influenced by other people's feelings,Questionnaire Three - I can't relax until I have done everything I had planned to do that day,Would you like to exit the study and go to the debrief?,Questionnaire Three - I can easily tell if someone else is interested or bored with what I am saying,Questionnaire Three - I get upset if I see people suffering on news programmes,Questionnaire Three - Friends usually talk to me about their problems as they I am as they say I am very understanding,"Questionnaire Three - I can sense if I am intruding, even if the other person doesn't tell me",Questionnaire Three - I often start new hobbies but quickly become bored with them and move on to something else,Questionnaire Three - People sometimes tell me that I have gone too far with teasing,Questionnaire Three - I would be too nervous to go on a big rollercoaster,"Questionnaire Three - Other people often say that I am insensitive, though I don't always see why","Questionnaire Three - If I see a stranger in a group, I think that it is up to them to make an effort to join in",Questionnaire Three - I usually stay emotionally detached when watching a film,Questionnaire Three - I like to be very organised in day to day life and often make lists of the chores I have to do,Questionnaire Three - I can tune into how someone else feels rapidly and intuitively,Questionnaire Three - I don't like to take risks,Questionnaire Three - I can easily work out what another person might want to talk about,Questionnaire Three - I can tell if someone is masking their true emotions,Questionnaire Three - Before making a decisions I always weigh up the pros and cons,Questionnaire Three - I don't consciously work out the rules of social situations,Questionnaire Three - I am good at predicting what someone will do,Questionnaire Three - I tend to get emotionally involved with a friend's problems,"Questionnaire Three - I can usually appreciate the other person's viewpoint, even if I don't agree with it",Would you like to exit the study and go to the debrief?,"Questionnaire Four - How often do you have trouble wrapping up the final details of a project, once the challenging parts have been done?",Questionnaire Four - How often do you have difficulty getting things in order when you have to do a task that requires organisation?,Questionnaire Four - How often do you have problems remembering appointments or obligations?,"Questionnaire Four - When you have a task that requires a lot of thought, how often do you avoid or delay getting started",Questionnaire Four - How often do you fidget or squirm with your hands or feet when you have to sit down for a long time?,"Questionnaire Four - How often do you feel overly active and compelled to do things, like you were driven by a motor?",Questionnaire Four - How often do you make careless mistakes when you have to work on a boring or difficult project?,Questionnaire Four - How often do you have difficulty keeping your attention when you are doing boring or repetitive work?,"Questionnaire Four - How often do you have difficulty concentrating on what people say to you, even when they are speaking to you directly?",Questionnaire Four - How often do you misplace or have difficulty finding things at home or at work?,Questionnaire Four - How often are you distracted by activity or noise around you?,Questionnaire Four - How often do you leave your seat in meetings or other situations in which you are expected to remain seated?,Questionnaire Four - How often do you feel restless or fidgety?,Questionnaire Four - How often do you have difficulty unwinding and relaxing when you have time to yourself?,Questionnaire Four - How often do you find yourself talking too much when you are in social situations?,"Questionnaire Four - When you’re in a conversation, how often do you find yourself finishing the sentences of the people you are talking to, before they can finish them themselves?",Questionnaire Four - How often do you have difficulty waiting your turn in situations when turn taking is required?,Questionnaire Four - How often do you interrupt others when they are busy?,Would you like to exit the study and go to the debrief?,Did you give the study your full attention?,I am happy to submit my answers
Yes,Yes,Yes,Yes,Yes,Yes,Yes,Yes,Female,20,Almost Always,Most of the time,Sometimes,Almost Never,Almost Never,Most of the time,Most of the time,Almost Always,Almost Never,Most of the time,Sometimes,Sometimes,Most of the time,Sometimes,Almost Never,Almost Never,Half the time,Most of the time,No,Sometimes,Sometimes,Almost Never,Most of the time,Half the time,Most of the time,Sometimes,Most of the time,Sometimes,Almost Never,Sometimes,Half the time,Sometimes,Sometimes,Most of the time,Half the time,Sometimes,Sometimes,No,Rarely (less then a day),Rarely (less then a day),Rarely (less then a day),Most of the time (5-7 days),Occasionally (3-4 days),Rarely (less then a day),Sometimes (1-2 days),Most of the time (5-7 days),Rarely (less then a day),Rarely (less then a day),Sometimes (1-2 days),Most of the time (5-7 days),Rarely (less then a day),Rarely (less then a day),Rarely (less then a day),Most of the time (5-7 days),Rarely (less then a day),Rarely (less then a day),Rarely (less then a day),Rarely (less then a day),No,Slightly Agree,Strongly Disagree,Strongly agree,Strongly agree,Strongly agree,Slightly Disagree,Slightly Disagree,Slightly Agree,Slightly Disagree,Strongly Disagree,Slightly Disagree,Strongly Disagree,Strongly agree,Strongly Disagree,Slightly Disagree,Strongly Disagree,Slightly Disagree,Strongly Disagree,Slightly Agree,Slightly Agree,No,Slightly Disagree,Slightly Agree,Strongly agree,Slightly Disagree,Slightly Agree,Strongly agree,Strongly Disagree,Strongly Disagree,Strongly Disagree,Strongly Disagree,Slightly Disagree,Slightly Disagree,Strongly Disagree,Strongly Disagree,Strongly agree,Slightly Agree,Slightly Disagree,Strongly agree,Slightly Agree,Slightly Disagree,No,Slightly Agree,Slightly Disagree,Slightly Agree,Slightly Agree,Strongly Disagree,Strongly Disagree,Strongly agree,Strongly Disagree,Slightly Disagree,Slightly Disagree,Slightly Agree,Slightly Agree,Slightly Agree,Slightly Agree,Slightly Agree,Slightly Disagree,Slightly Agree,Slightly Agree,Slightly Disagree,Slightly Agree,No,Rarely,Something,Often,Often,Something,Something,Very Often,Very Often,Rarely,Never,Never,Never,Never,Never,Something,Never,Something,Something,No,Definitely yes,Submit
Yes,Yes,Yes,Yes,Yes,Yes,Yes,Yes,Female,19,Sometimes,Sometimes,Most of the time,Most of the time,Most of the time,Half the time,Sometimes,Most of the time,Almost Always,Sometimes,Most of the time,Almost Always,Most of the time,Most of the time,Most of the time,Almost Always,Almost Never,Most of the time,No,Sometimes,Sometimes,Most of the time,Most of the time,Most of the time,Sometimes,Almost Always,Most of the time,Sometimes,Half the time,Most of the time,Almost Always,Half the time,Sometimes,Half the time,Almost Always,Most of the time,Most of the time,No,Sometimes (1-2 days),Occasionally (3-4 days),Most of the time (5-7 days),Sometimes (1-2 days),Occasionally (3-4 days),Most of the time (5-7 days),Most of the time (5-7 days),Rarely (less then a day),Most of the time (5-7 days),Occasionally (3-4 days),Most of the time (5-7 days),Rarely (less then a day),Most of the time (5-7 days),Most of the time (5-7 days),Sometimes (1-2 days),Rarely (less then a day),Rarely (less then a day),Most of the time (5-7 days),Most of the time (5-7 days),Occasionally (3-4 days),No,Slightly Agree,Strongly agree,Strongly Disagree,Slightly Agree,Strongly Disagree,Strongly agree,Strongly Disagree,Slightly Agree,Strongly Disagree,Strongly Disagree,Strongly Disagree,Slightly Agree,Strongly agree,Slightly Agree,Strongly Disagree,Slightly Agree,Strongly agree,Strongly Disagree,Slightly Agree,Slightly Agree,No,Strongly Disagree,Slightly Agree,Slightly Agree,Strongly Disagree,Slightly Agree,Strongly agree,Strongly Disagree,Slightly Agree,Strongly Disagree,Slightly Disagree,Strongly Disagree,Slightly Disagree,Strongly Disagree,Slightly Disagree,Slightly Agree,Slightly Agree,Slightly Agree,Strongly agree,Slightly Disagree,Slightly Disagree,No,Strongly agree,Slightly Agree,Slightly Agree,Slightly Agree,Slightly Disagree,Strongly Disagree,Strongly agree,Slightly Disagree,Slightly Agree,Strongly Disagree,Slightly Disagree,Slightly Agree,Slightly Disagree,Slightly Agree,Slightly Agree,Strongly agree,Slightly Agree,Slightly Agree,Slightly Agree,Strongly agree,No,Often,Something,Rarely,Something,Very Often,Something,Rarely,Rarely,Often,Often,Very Often,Never,Often,Often,Often,Often,Often,Often,No,Probably yes,Submit
Yes,Yes,Yes,Yes,Yes,Yes,Yes,Yes,Female,48,Most of the time,Half the time,Almost Always,Almost Never,Almost Never,Most of the time,Almost Always,Almost Always,Sometimes,Almost Always,Most of the time,Half the time,Most of the time,Half the time,Sometimes,Half the time,Most of the time,Most of the time,No,Most of the time,Half the time,Half the time,Most of the time,Most of the time,Sometimes,Half the time,Most of the time,Most of the time,Half the time,Half the time,Most of the time,Sometimes,Most of the time,Most of the time,Half the time,Almost Always,Almost Always,No,Rarely (less then a day),Sometimes (1-2 days),Sometimes (1-2 days),Occasionally (3-4 days),Most of the time (5-7 days),Most of the time (5-7 days),Most of the time (5-7 days),Occasionally (3-4 days),Occasionally (3-4 days),Most of the time (5-7 days),Most of the time (5-7 days),Occasionally (3-4 days),Sometimes (1-2 days),Sometimes (1-2 days),Most of the time (5-7 days),Occasionally (3-4 days),Most of the time (5-7 days),Most of the time (5-7 days),Most of the time (5-7 days),Sometimes (1-2 days),No,Slightly Agree,Strongly Disagree,Strongly Disagree,Strongly Disagree,Slightly Agree,Strongly agree,Strongly agree,Slightly Agree,Strongly Disagree,Strongly agree,Strongly Disagree,Slightly Agree,Strongly Disagree,Slightly Disagree,Strongly Disagree,Strongly Disagree,Slightly Agree,Strongly Disagree,Slightly Agree,Slightly Agree,No,Slightly Agree,Strongly agree,Slightly Agree,Strongly agree,Slightly Agree,Strongly agree,Strongly agree,Strongly agree,Strongly agree,Strongly agree,Slightly Disagree,Strongly Disagree,Strongly agree,Strongly agree,Slightly Disagree,Strongly agree,Strongly agree,Strongly agree,Strongly agree,Slightly Agree,No,Strongly agree,Slightly Agree,Strongly agree,Strongly agree,Strongly Disagree,Slightly Agree,Strongly Disagree,Slightly Disagree,Slightly Disagree,Strongly Disagree,Slightly Agree,Strongly agree,Strongly Disagree,Slightly Agree,Strongly agree,Slightly Agree,Slightly Disagree,Slightly Agree,Slightly Agree,Slightly Agree,No,Rarely,Rarely,Rarely,Rarely,Something,Often,Rarely,Something,Something,Often,Very Often,Rarely,Something,Rarely,Often,Rarely,Rarely,Rarely,No,Definitely yes,Submit
Yes,Yes,Yes,Yes,Yes,Yes,Yes,Yes,Female,22,Sometimes,Almost Always,Sometimes,Sometimes,Sometimes,Half the time,Half the time,Almost Always,Sometimes,Almost Always,Almost Always,Almost Always,Almost Always,Sometimes,Sometimes,Almost Never,Almost Always,Almost Always,No,Sometimes,Almost Never,Almost Always,Sometimes,Sometimes,Sometimes,Sometimes,Almost Always,Sometimes,Almost Never,Almost Always,Almost Always,Sometimes,Sometimes,Almost Always,Sometimes,Sometimes,Sometimes,No,Sometimes (1-2 days),Sometimes (1-2 days),Sometimes (1-2 days),Rarely (less then a day),Most of the time (5-7 days),Sometimes (1-2 days),Sometimes (1-2 days),Sometimes (1-2 days),Sometimes (1-2 days),Sometimes (1-2 days),Sometimes (1-2 days),Sometimes (1-2 days),Sometimes (1-2 days),Sometimes (1-2 days),Sometimes (1-2 days),Sometimes (1-2 days),Sometimes (1-2 days),Sometimes (1-2 days),Sometimes (1-2 days),Sometimes (1-2 days),No,Slightly Agree,Slightly Agree,Slightly Disagree,Slightly Agree,Strongly agree,Strongly agree,Strongly agree,Strongly agree,Strongly agree,Slightly Agree,Slightly Disagree,Slightly Disagree,Strongly agree,Strongly Disagree,Strongly Disagree,Strongly Disagree,Strongly Disagree,Strongly Disagree,Strongly agree,Strongly agree,No,Strongly Disagree,Strongly Disagree,Strongly agree,Strongly Disagree,Strongly agree,Strongly agree,Strongly Disagree,Strongly Disagree,Strongly Disagree,Strongly agree,Strongly Disagree,Strongly Disagree,Strongly Disagree,Strongly Disagree,Strongly Disagree,Strongly agree,Strongly agree,Strongly agree,Strongly Disagree,Strongly Disagree,No,Strongly agree,Strongly agree,Strongly agree,Strongly agree,Strongly Disagree,Strongly Disagree,Strongly Disagree,Strongly Disagree,Slightly Agree,Strongly Disagree,Strongly agree,Strongly agree,Strongly agree,Strongly agree,Strongly agree,Strongly agree,Strongly Disagree,Strongly agree,Strongly agree,Strongly agree,No,Something,Something,Something,Something,Something,Something,Something,Something,Something,Something,Something,Something,Something,Something,Something,Something,Something,Something,No,Probably yes,Submit
Yes,Yes,Yes,Yes,Yes,Yes,Yes,Yes,Female,31,Sometimes,Sometimes,Most of the time,Most of the time,Most of the time,Almost Never,Sometimes,Most of the time,Sometimes,Almost Never,Almost Always,Almost Always,Almost Always,Almost Always,Sometimes,Sometimes,Almost Never,Most of the time,No,Most of the time,Almost Never,Most of the time,Most of the time,Almost Always,Almost Never,Almost Always,Almost Always,Almost Always,Most of the time,Almost Always,Almost Always,Sometimes,Almost Always,Most of the time,Almost Never,Sometimes,Almost Always,No,Occasionally (3-4 days),Sometimes (1-2 days),Most of the time (5-7 days),Most of the time (5-7 days),Most of the time (5-7 days),Occasionally (3-4 days),Most of the time (5-7 days),Most of the time (5-7 days),Rarely (less then a day),Most of the time (5-7 days),Most of the time (5-7 days),Sometimes (1-2 days),Occasionally (3-4 days),Most of the time (5-7 days),Most of the time (5-7 days),Occasionally (3-4 days),Most of the time (5-7 days),Most of the time (5-7 days),Most of the time (5-7 days),Occasionally (3-4 days),No,Strongly agree,Strongly agree,Strongly Disagree,Slightly Disagree,Strongly Disagree,Slightly Agree,Strongly agree,Slightly Agree,Strongly agree,Slightly Agree,Strongly Disagree,Slightly Agree,Slightly Disagree,Strongly Disagree,Strongly Disagree,Slightly Agree,Slightly Agree,Slightly Disagree,Strongly agree,Slightly Agree,No,Strongly Disagree,Strongly agree,Strongly agree,Slightly Disagree,Slightly Agree,Strongly agree,Strongly Disagree,Slightly Agree,Strongly Disagree,Slightly Disagree,Strongly Disagree,Slightly Agree,Strongly Disagree,Slightly Agree,Slightly Disagree,Slightly Agree,Slightly Disagree,Strongly agree,Strongly Disagree,Strongly agree,No,Strongly agree,Slightly Agree,Strongly agree,Strongly agree,Strongly agree,Slightly Agree,Strongly Disagree,Slightly Agree,Slightly Disagree,Strongly agree,Strongly Disagree,Slightly Agree,Strongly Disagree,Slightly Agree,Slightly Agree,Slightly Disagree,Slightly Disagree,Strongly agree,Strongly Disagree,Strongly agree,No,Very Often,Very Often,Very Often,Very Often,Very Often,Very Often,Very Often,Very Often,Very Often,Very Often,Very Often,Never,Very Often,Very Often,Very Often,Very Often,Never,Never,No,Definitely yes,Submit
